name,简介,年龄,支持退款,分类,标签,游戏形式,语言,使用范围,控制方式,支持平台,版本,更新日期,大小,开发者,发行商,开发者隐私政策,开发者服务条款,开发者网站,权限,名称,start,end
《零封》,"简介为您奉上终极VR守门员体验!  测试反应能力，磨炼条件反射，进行高强度锻炼。只需守住球门（如果您能做到的话）。

速射模式：足球不断向您袭来。在零封体育场令人心潮澎湃的氛围中，无尽的射门如潮涌至，而您的扑救将力挽狂澜。您将以何种成绩登录我们的全服排行榜？

定位球模式：激动人心的真实职业足球。世界级的凌空抽射、头球、任意球以及各个角度的超逼真射门。您能否完成最扣人心弦的扑救，从迷你球门一路战至全尺寸球门？

最先进的物理特性，最前沿的图形设计，再加上优秀的动作捕捉技术，共同创造出独一无二的沉浸式VR体验。

为您奉上终极VR守门员体验!  测试反应能力，磨炼条件反射，进行高强度锻炼。只需守住球门（如果您能做到的话）。

速射模式：足球不断向您袭来。在零封体育场令人心潮澎湃的氛围中，无尽的射门如潮涌至，而您的扑救将力挽狂澜。您将以何种成绩登录我们的全服排行榜？

定位球模式：激动人心的真实职业足球。世界级的凌空抽射、头球、任意球以及各个角度的超逼真射门。您能否完成最扣人心弦的扑救，从迷你球门一路战至全尺寸球门？

最先进的物理特性，最前沿的图形设计，再加上优秀的动作捕捉技术，共同创造出独一无二的沉浸式VR体验。

",年龄：12+,支持退款申请：PICO退款政策,分类：游戏,"标签：运动, 模拟, 教育",游戏形式：单人,"语言：英语, 简体中文",使用范围：房间移动,控制方式：6-DOF 手柄,"支持平台：PICO 4, PICO Neo3, PICO Neo3 Eye, PICO Neo3 Pro, PICO 4 Pro",版本：2022.3.6P_CN,更新日期：2023-2-16,大小：339.2 MB,开发者：INCISIV Ltd,发行商：INCISIV Ltd,开发者隐私政策：隐私政策,开发者服务条款：服务条款,开发者网站：https://www.incisiv.tech,权限：存储空间,《零封》,2023-09-21 01:52:49,2023-09-21 01:54:33
