name,简介,年龄,支持退款,分类,标签,游戏形式,语言,使用范围,控制方式,支持平台,版本,更新日期,大小,开发者,发行商,开发者隐私政策,开发者网站,权限,名称,start,end
萌宠乐园,"简介超可爱的宠物正等你来和它们玩哟——快来萌宠乐园体验撸猫撸狗的快乐吧！
在宠物乐园，你可以做很多事，可以抚摸可爱的狗狗，与超萌的猫咪玩耍，给它们喂零食，让它们好好休息，还可以在美丽的公园里无忧无虑地散步，以及玩小游戏，而且在小游戏中可以赢得特殊分数哦！
准备好迎接挑战了吗？是时候进行训练了！学习特殊手势并指导宠物表演不同的动作——只要坚持不懈一切都很轻松，但要记住一点，宠物有时也会忘记哦！适时给予自己和宠物一些奖励，拥有不一样的新奇体验！还可以用点数来兑换各种有趣的装饰品。尽情探索萌宠乐园吧！祝大家玩得开心！
超可爱的宠物正等你来和它们玩哟——快来萌宠乐园体验撸猫撸狗的快乐吧！
在宠物乐园，你可以做很多事，可以抚摸可爱的狗狗，与超萌的猫咪玩耍，给它们喂零食，让它们好好休息，还可以在美丽的公园里无忧无虑地散步，以及玩小游戏，而且在小游戏中可以赢得特殊分数哦！
准备好迎接挑战了吗？是时候进行训练了！学习特殊手势并指导宠物表演不同的动作——只要坚持不懈一切都很轻松，但要记住一点，宠物有时也会忘记哦！适时给予自己和宠物一些奖励，拥有不一样的新奇体验！还可以用点数来兑换各种有趣的装饰品。尽情探索萌宠乐园吧！祝大家玩得开心！
",年龄：8+,支持退款申请：PICO退款政策,分类：游戏,"标签：休闲, 放松, 卡通",游戏形式：单人,"语言：英语, 简体中文","使用范围：原地站立, 原地坐姿, 房间移动",控制方式：6-DOF 手柄,"支持平台：PICO 4, PICO Neo3, PICO 4 Pro",版本：1.61,更新日期：2022-12-21,大小：753.6 MB,开发者：Actum Games,发行商：Actum Games,开发者隐私政策：隐私政策,开发者网站：https://actum.games,权限：存储空间,萌宠乐园,2023-09-22 03:05:27,2023-09-22 03:07:38
