name,简介,年龄,支持退款,分类,标签,游戏形式,语言,使用范围,控制方式,支持平台,版本,更新日期,大小,开发者,发行商,开发者隐私政策,开发者服务条款,开发者网站,权限,名称,start,end
星际巫师,"简介使用萨满球施展法术,召唤各种武器,在French Touch的背景音乐节奏下,在壮观的星系中战斗。

在一个美轮美奂、程序化生成的宇宙中,从一个星球跳到另一个太阳系,在这个宇宙中,没有一个玩法是相同的。

摔倒，再试一次，解锁强大的新武器和能力，找到自己的玩法。使用独特的和超令人满意的基于运动的施法系统来调用它们，很快就会让你感到无敌。

与致命的机械敌人的舰队作战，直到你达到史诗般的boss战，阻挡你通往新的太阳系的道路。一路走来，你会遇到一个古怪的角色名册。

当你追赶腐败的熵建筑师到他们立方体宇宙中最偏远的角落时，别忘了欣赏那些非凡的生命形式的细枝末节，你会让他们重获新生。

因为你是星际巫师，是生物多样性的拥护者，也是银河系的最后手段。使用萨满球施展法术,召唤各种武器,在French Touch的背景音乐节奏下,在壮观的星系中战斗。

在一个美轮美奂、程序化生成的宇宙中,从一个星球跳到另一个太阳系,在这个宇宙中,没有一个玩法是相同的。

摔倒，再试一次，解锁强大的新武器和能力，找到自己的玩法。使用独特的和超令人满意的基于运动的施法系统来调用它们，很快就会让你感到无敌。

与致命的机械敌人的舰队作战，直到你达到史诗般的boss战，阻挡你通往新的太阳系的道路。一路走来，你会遇到一个古怪的角色名册。

当你追赶腐败的熵建筑师到他们立方体宇宙中最偏远的角落时，别忘了欣赏那些非凡的生命形式的细枝末节，你会让他们重获新生。

因为你是星际巫师，是生物多样性的拥护者，也是银河系的最后手段。",年龄：8+,支持退款申请：PICO退款政策,分类：游戏,"标签：动作, 射击, 太空",游戏形式：单人,语言：简体中文,"使用范围：原地站立, 房间移动",控制方式：6-DOF 手柄,"支持平台：PICO Neo2, PICO Neo3, PICO 4, PICO 4 Pro",版本：22.0.0,更新日期：2022-9-8,大小：570.2 MB,开发者：Ikimasho,发行商：Ikimasho,开发者隐私政策：隐私政策,开发者服务条款：服务条款,开发者网站：http://www.ikimasho.games,"权限：存储空间, 麦克风",星际巫师,2023-09-22 04:51:27,2023-09-22 04:53:30
